,id,overview,title,release_date,popularity,vote_average,vote_count
1572,57800,"Manny, Diego, and Sid embark upon another adventure after their continent is set adrift. Using an iceberg as a ship, they encounter sea creatures and battle pirates as they explore a new world.",Ice Age: Continental Drift,2012-06-27,66.191,6.4,7606
1573,10192,"A bored and domesticated Shrek pacts with deal-maker Rumpelstiltskin to get back to feeling like a real ogre again, but when he's duped and sent to a twisted version of Far Far Away—where Rumpelstiltskin is king, ogres are hunted, and he and Fiona have never met—he sets out to restore his world and reclaim his true love.",Shrek Forever After,2010-05-16,108.488,6.38,7401
1574,41733,"Peter Highman must scramble across the US in five days to be present for the birth of his first child. He gets off to a bad start when his wallet and luggage are stolen, and put on the 'no-fly' list. Peter embarks on a terrifying journey when he accepts a ride from an actor.",Due Date,2010-11-03,26.149,6.4,5416
1575,593910,"Cinderella, an orphaned girl with an evil stepmother, has big dreams and with the help of her Fabulous Godmother, she perseveres to make them come true.",Cinderella,2021-09-03,32.868,6.4,1403
1576,298729,Serena Bruno is an architect who studied and got several masters in different countries of the world but she decides to go back to Italy so she can live and work there. She will soon find out that her native country is not as open minded and she will struggle to find a job that she truly loves and is passionate about. Along the way she will meet Francesco a gay man who will help and support her throughout her journey.,Do You See Me?,2014-11-20,12.207,6.375,566
1577,294652,"Locked up for a minor crime, 19 year old JR quickly learns the harsh realities of prison life. Protection, if you can get it, is paramount. JR soon finds himself under the watchful eye of Australia's most notorious criminal, Brendan Lynch, but protection comes at a price.",Son of a Gun,2014-10-16,16.513,6.375,762
1578,74018,"In this modern telling of the classic tale, aspiring singer Katie Gibbs falls for the new boy at her performing arts high school. But Katie's wicked stepmother and stepsister are scheming to crush her dream before she can sing her way into his heart.",A Cinderella Story: Once Upon a Song,2011-09-05,20.849,6.375,1014
1579,1734,"Rick and Evelyn O’Connell, along with their 8-year-old son Alex, discover the key to the legendary Scorpion King’s might: the fabled Bracelet of Anubis. Unfortunately, a newly resurrected Imhotep has designs on the bracelet as well, and isn’t above kidnapping its new bearer, Alex, to gain control of Anubis’s otherworldly army.",The Mummy Returns,2001-05-04,64.252,6.4,7077
1580,8077,"After escaping with Newt and Hicks from the alien planet, Ripley crash lands on Fiorina 161, a prison planet and host to a correctional facility. Unfortunately, although Newt and Hicks do not survive the crash, a more unwelcome visitor does. The prison does not allow weapons of any kind, and with aid being a long time away, the prisoners must simply survive in any way they can.",Alien³,1992-05-22,40.48,6.371,5749
1581,799379,"While under heavily armed guard, the dangerous convicts aboard a cargo ship unite in a coordinated escape attempt that soon escalates into a bloody, all-out riot. But as the fugitives continue their brutal campaign of terror, they soon discover that not even the most vicious among them is safe from the horror they unknowingly unleashed from the darkness below deck.",Project Wolf Hunting,2022-09-21,64.868,6.4,366
1582,753342,"An epic that details the checkered rise and fall of French Emperor Napoleon Bonaparte and his relentless journey to power through the prism of his addictive, volatile relationship with his wife, Josephine.",Napoleon,2023-11-22,63.035,6.37,2596
1583,250574,"Looking for work, Aaron comes across a cryptic online ad: “$1,000 for the day. Filming service. Discretion is appreciated.” Low on cash and full of naiveté, he decides to go for it. He drives to a cabin in a remote mountain town where he meets Josef, his cinematic subject for the day. Josef is sincere and the project seems heartfelt, so Aaron begins to film. But as the day goes on, it becomes clear that Josef is not who he says, and his intentions are not at all pure.",Creep,2014-06-23,21.072,6.37,1423
1584,10611,"A day in the life of a barbershop on the south side of Chicago. Calvin, who inherited the struggling business from his deceased father, views the shop as nothing but a burden and waste of his time. After selling the shop to a local loan shark, Calvin slowly begins to see his father's vision and legacy and struggles with the notion that he just sold it out.",Barbershop,2002-04-01,23.838,6.37,479
1585,82682,"Los Angeles, 1949. Ruthless, Brooklyn-born mob king Mickey Cohen runs the show in this town, reaping the ill-gotten gains from the drugs, the guns, the prostitutes and — if he has his way — every wire bet placed west of Chicago. And he does it all with the protection of not only his own paid goons, but also the police and the politicians who are under his control. It’s enough to intimidate even the bravest, street-hardened cop… except, perhaps, for the small, secret crew of LAPD outsiders led by Sgt. John O’Mara and Jerry Wooters who come together to try to tear Cohen’s world apart.",Gangster Squad,2013-01-09,19.539,6.365,4029
1586,13225,"When a sprite named Crysta shrinks a human boy, Zak, down to her size, he vows to help the magical fairy folk stop a greedy logging company from destroying their home: the pristine rainforest known as FernGully. Zak and his new friends fight to defend FernGully from lumberjacks — and the vengeful spirit they accidentally unleash after chopping down a magic tree.",FernGully: The Last Rainforest,1992-04-10,23.174,6.365,572
1587,12435,"A college graduate goes to work as a nanny for a rich New York family. Ensconced in their home, she has to juggle their dysfunction, a new romance, and the spoiled brat in her charge.",The Nanny Diaries,2007-08-24,19.698,6.365,1148
1588,11212,"Baby Bink couldn't ask for more: he has adoring (if somewhat sickly-sweet) parents, lives in a huge mansion, and he's just about to appear in the social pages of the paper. Unfortunately, not everyone in the world is as nice as Baby Bink's parents—especially the three enterprising kidnappers who pretend to be photographers from the newspaper. Successfully kidnapping Baby Bink, they have a harder time keeping hold of the rascal, who not only keeps one step ahead of them, but seems to be more than a little bit smarter than the three bumbling criminals.",Baby's Day Out,1994-07-01,41.484,6.4,1330
1589,528491,"In a locked down train station, a homicide detective conducts an interview with a tormented monkey  who is suspected of murder.",WHAT DID JACK DO?,2017-11-08,12.065,6.4,479
1590,20481,"A troubled young man is drawn to a mythical place called Midian where a variety of friendly monsters are hiding from humanity. Meanwhile, a sadistic serial killer is looking for a patsy.",Nightbreed,1990-02-16,13.3,6.361,468
1591,13022,"When a group of tourists stumble into the remote Australian river territory of an enormous crocodile, the deadly creature traps them on a tiny mud island with the tide quickly rising and darkness descending. As the hungry predator closes in, they must fight for survival against all odds.",Rogue,2007-11-08,23.142,6.4,692
1592,11913,"The whole clique of Cruchot's police station is retired. Now he lives with his rich wife in her castle - and is bored almost to death. He fights with the butler, because he isn't even allowed to do the simple works. But when one of the clique suffers from amnesia after an accident, all of the others reunite and kidnap him, to take him on a tour to their old working places and through their memories. In their old uniforms they turn St. Tropez upside down.",The Gendarme Takes Off,1970-10-28,14.751,6.4,511
1593,9718,"The fastest man on four wheels, Ricky Bobby is one of the greatest drivers in NASCAR history. A big, hairy American winning machine, Ricky has everything a dimwitted daredevil could want, a luxurious mansion, a smokin' hot wife and all the fast food he can eat. But Ricky's turbo-charged lifestyle hits an unexpected speed bump when he's bested by flamboyant Euro-idiot Jean Girard and reduced to a fear-ridden wreck.",Talladega Nights: The Ballad of Ricky Bobby,2006-08-04,18.893,6.361,1691
1594,6637,"Benjamin Franklin Gates and Abigail Chase re-team with Riley Poole and, now armed with a stack of long-lost pages from John Wilkes Booth's diary, Ben must follow a clue left there to prove his ancestor's innocence in the assassination of Abraham Lincoln.",National Treasure: Book of Secrets,2007-12-13,39.191,6.361,5153
1595,286987,"After inadvertently inputting the qualities of the ideal boyfriend into a high-tech government computer, two social outcasts named Mae and Gabby must contend with Albert, a cybernetic sweetheart with only one directive: to treat Mae to the perfect highschool romance.",How to Build a Better Boy,2014-11-18,14.796,6.4,395
1596,355547,A small but brave donkey and his animal friends become the unsung heroes of the greatest story ever told: the first Christmas.,The Star,2017-11-15,19.744,6.356,554
1597,48231,"Seduced by the challenge of an impossible case, the driven Dr. Carl Jung takes the unbalanced yet beautiful Sabina Spielrein as his patient. Jung’s weapon is the method of his master, the renowned Sigmund Freud. Both men fall under Sabina’s spell.",A Dangerous Method,2011-09-30,16.293,6.4,2064
1598,16229,"When talented young writer Elizabeth Wurtzel earns a scholarship to Harvard, she sees it as her chance to escape the pressures of her working-class background and concentrate on her true talent. But what starts out so promising leads to self-destructive behavior and paralyzing depression that reflects an entire generation's struggle to navigate the effects of divorce, drugs, sex, and high expectations.",Prozac Nation,2001-09-08,12.436,6.4,312
1599,11821,"After leaving Washington D.C. hospital, plastic surgeon Ben Stone heads for California, where a lucrative practice in Beverly Hills awaits. After a car accident, he's sentenced to perform as the community's general practitioner.",Doc Hollywood,1991-08-02,12.79,6.356,613
1600,24929,"A group of kids discover one of the drums containing a rotting corpse and release the 2-4-5 Trioxin gas into the air, causing the dead to once again rise from the grave and seek out brains.",Return of the Living Dead Part II,1988-01-15,15.107,6.353,621
1601,18487,"Armed men hijack a New York City subway train, holding the passengers hostage in return for a ransom, and turning an ordinary day's work for dispatcher Walter Garber into a face-off with the mastermind behind the crime.",The Taking of Pelham 1 2 3,2009-06-10,22.676,6.352,3119
1602,11560,"A female attorney learns that her husband is really a marine officer awol for fifteen years and accused of murdering fifteen civilians in El Salvador. Believing her husband when he tells her that he's being framed as part of a U.S. Military cover-up, the attorney defends him in a military court.",High Crimes,2002-04-05,17.51,6.4,793
1603,11427,"Christmas Eve. On his way to his in-laws with his family, Frank Harrington decides to try a shortcut, for the first time in 20 years. It turns out to be the biggest mistake of his life.",Dead End,2003-12-12,13.459,6.4,531
1604,1268,"Mr. Bean wins a trip to Cannes where he unwittingly separates a young boy from his father and must help the two reunite. On the way he discovers France, bicycling and true love, among other things.",Mr. Bean's Holiday,2007-03-22,29.27,6.352,2859
1605,157360,"An underachieving vocal coach is motivated by her father, the king of movie-trailer voice-overs, to pursue her aspirations of becoming a voice-over star. Amidst pride, sexism and family dysfunction, she sets out to change the voice of a generation.",In a World...,2013-08-09,9.669,6.348,516
1606,18086,"After three years of therapy Charley Brewster, now a college student, is convinced that Jerry Dandridge was a serial killer posing as a vampire. But when Regine, a mysterious actress and her entourage move into Peter Vincent's apartment block, the nightmare starts again - and this time it's personal!",Fright Night Part 2,1988-04-07,13.082,6.3,391
1607,8999,"When two married business executives having an affair are blackmailed by a violent criminal, they are forced to turn the tables on him to save their families.",Derailed,2005-11-11,14.439,6.348,1028
1608,332567,"When Nancy is surfing on a secluded beach, she finds herself on the feeding ground of a great white shark. Though she is stranded only 200 yards from shore, survival proves to be the ultimate test of wills, requiring all of Nancy's ingenuity, resourcefulness, and fortitude.",The Shallows,2016-06-24,38.718,6.3,5069
1609,82525,Pot growers Ben and Chon face off against the Mexican drug cartel who kidnapped their shared girlfriend.,Savages,2012-07-06,15.548,6.347,2147
1610,11002,"A shipping disaster in the 19th Century has stranded a man and woman in the wilds of Africa. The lady is pregnant, and gives birth to a son in their tree house. Soon after, a family of apes stumble across the house and in the ensuing panic, both parents are killed. A female ape takes the tiny boy as a replacement for her own dead infant, and raises him as her son. Twenty years later, Captain Phillippe D'Arnot discovers the man who thinks he is an ape. Evidence in the tree house leads him to believe that he is the direct descendant of the Earl of Greystoke, and thus takes it upon himself to return the man to civilization.","Greystoke: The Legend of Tarzan, Lord of the Apes",1984-03-30,21.648,6.344,465
1611,10056,"Davey Gordon, a New York City boxer at the end of his career, falls for dancer Gloria Price. However, their budding relationship is interrupted by Gloria's violent boss, Vincent Rapallo, who has eyes for Gloria. The two decide to skip town, but before they can, Vincent and his thugs abduct Gloria, and Davey is forced to search for her among the most squalid corners of the city, with his enemy hiding in the shadows.",Killer's Kiss,1955-10-01,8.212,6.3,542
1612,435615,"Tasya Vos, an elite corporate assassin, uses brain-implant technology to take control of other people’s bodies to terminate high profile targets. As she sinks deeper into her latest assignment, Vos becomes trapped inside a mind that threatens to obliterate her.",Possessor,2020-10-02,15.302,6.3,882
1613,18269,"Lady and Tramp's mischievous pup, Scamp, gets fed up with rules and restrictions imposed on him by life in a family, and longs for a wild and free lifestyle. He runs away from home and into the streets where he joins a pack of stray dogs known as the ""Junkyard Dogs."" Buster, the pack's leader, takes an instant disliking to the ""house-dog"" and considers him a rival. Angel, a junkyard pup Scamp's age, longs for the safety and comfort of life in a family and the two become instant companions. Will Scamp choose the wild and free life of a stray or the unconditional love of his family?",Lady and the Tramp II: Scamp's Adventure,2001-02-18,27.468,6.3,1253
1614,13394,"The Christmas tree isn't the only thing green in this new holiday classic. Shrek is back and trying to get into the spirit of the season. After promising Fiona and the kids a Christmas they'll remember, he is forced to take a crash course in the holiday. But just when he thinks he has everything for their quiet family Christmas just right, there is a knock at the door.",Shrek the Halls,2007-11-28,27.166,6.343,855
1615,179538,A gang of gold thieves land in a coven of witches who are preparing for an ancient ritual... and in need of a sacrifice.,Witching & Bitching,2013-09-20,10.855,6.3,640
1616,41283,"After 10 years in prison, Driver is now a free man with a single focus - hunting down the people responsible for brutally murdering his brother.",Faster,2010-11-23,30.261,6.339,1930
1617,26170,"Coogan, an Arizona deputy sheriff goes to New York to pick up a prisoner. While escorting the prisoner to the airport, he escapes and Coogan heads into the city to recapture him.",Coogan's Bluff,1968-10-02,14.252,6.3,329
1618,4351,"American corporations are using the North American Free Trade Agreement by opening large maquiladoras right across the United States–Mexico border. The maquiladoras hire mostly Mexican women to work long hours for little money in order to produce mass quantity products. Lauren Adrian, an impassioned American news reporter for the Chicago Sentinel wants to be assigned to the Iraq front-lines to cover the war. Instead, her editor George Morgan assigns her to investigate a series of slayings involving young maquiladora factory women in a Mexican bordertown.",Bordertown,2007-02-22,11.296,6.338,324
1619,2026,"When a mafia accountant is taken hostage on his beat, a police officer – wracked by guilt from a prior stint as a negotiator – must negotiate the standoff, even as his own family is held captive by the mob.",Hostage,2005-03-10,17.835,6.338,1604
1620,13600,"For generations, the people of the City of Ember have flourished in an amazing world of glittering lights. But Ember's once powerful generator is failing and the great lamps that illuminate the city are starting to flicker. Now, two teenagers, in a race against time, must search Ember for clues that will unlock the ancient mystery of the city's existence, before the the lights go out forever.",City of Ember,2008-10-07,27.021,6.334,1739
1621,1013860,"When Sheriff Roy Pulsipher finds himself in the afterlife, he joins a special police force and returns to Earth to save humanity from the undead.",R.I.P.D. 2: Rise of the Damned,2022-11-15,27.612,6.333,594
1622,838330,"An ambitious young woman, desperate for followers and fame, fakes a trip to Paris to up her social media presence. When a terrifying incident takes place in the real world and becomes part of her imaginary trip, her white lie becomes a moral quandary that offers her all the attention she’s wanted.",Not Okay,2022-07-29,15.27,6.3,453
1623,121606,"A man imprisons his estranged junkie friend in an isolated cabin in the boonies of San Diego to force him through a week of sobriety, but the events of that week are being mysteriously manipulated.",Resolution,2012-04-22,10.361,6.3,392
1624,38117,"A modern-day take on the ""Beauty and the Beast"" tale where a New York teen is transformed into a hideous monster in order to find true love.",Beastly,2011-01-21,16.991,6.331,2763
1625,169917,Private investigator Matthew Scudder is hired by a drug kingpin to find out who kidnapped and murdered his wife.,A Walk Among the Tombstones,2014-09-18,39.459,6.3,2811
1626,22824,"Since the 1960s, a disproportionate number of the population in and around Nome, Alaska, have gone missing. Despite FBI investigations, the disappearances remain a mystery. Dr. Abigail Tyler, a psychologist, may be on the verge of blowing the unsolved cases wide open when, during the course of treating her patients, she finds evidence of alien abductions.",The Fourth Kind,2009-11-05,24.039,6.328,1715
1627,22582,The popular cartoon cat and mouse are thrown into a feature film. The story has the twosome trying to help an orphan girl who is being berated and exploited by a greedy guardian.,Tom and Jerry: The Movie,1992-10-01,22.892,6.3,580
1628,12912,"Frank Allen, a professional speaker who lectures on time management has a perfectly ordered and scheduled life, down to the minute. When his wife sets his clock forward 10 minutes as a joke, his day is thrown off. Deciding that his strictly ordered life has done him little good, he begins to make multiple choice index cards, choosing one at random and doing what is written on the card.",Chaos Theory,2008-04-11,10.327,6.328,384
1629,9777,"Catherine is a woman in her late twenties who is strongly devoted to her father, Robert, a brilliant and well-known mathematician whose grip on reality is beginning to slip away. As Robert descends into madness, Catherine begins to wonder if she may have inherited her father's mental illness along with his mathematical genius.",Proof,2005-09-05,8.834,6.328,673
1630,549294,"Two New Orleans paramedics' lives are ripped apart after encountering a series of horrific deaths linked to a designer drug with bizarre, otherworldly effects.",Synchronic,2020-10-23,15.552,6.322,950
1631,477489,"When a deadly mist engulfs Paris, people find refuge in the upper floors of the buildings. With no information, no electricity and hardly any supplies, Mathieu, Anna and their daughter Sarah try to survive the disaster.",Just a Breath Away,2018-04-04,19.747,6.3,791
1632,447200,"Framed and on the run, a former FBI agent must save his family from a blazing fire in the world's tallest building.",Skyscraper,2018-07-11,31.559,6.322,5005
1633,431530,"Amy, Kiki and Carla – three under-appreciated and over-burdened women – rebel against the challenges and expectations of the Super Bowl for mothers: Christmas. And if creating a more perfect holiday for their families wasn’t hard enough, they have to do all of that while hosting and entertaining their own mothers.",A Bad Moms Christmas,2017-08-04,20.174,6.322,2093
1634,137116,"In this fully animated, all-new take on the Smurfs, a mysterious map sets Smurfette and her friends Brainy, Clumsy and Hefty on an exciting race through the Forbidden Forest leading to the discovery of the biggest secret in Smurf history.",Smurfs: The Lost Village,2017-03-23,32.735,6.3,1444
1635,10314,"High school hotshot Zach Siler is the envy of his peers. But his popularity declines sharply when his cheerleader girlfriend, Taylor, leaves him for sleazy reality-television star Brock Hudson. Desperate to revive his fading reputation, Siler agrees to a seemingly impossible challenge. He has six weeks to gain the trust of nerdy outcast Laney Boggs -- and help her to become the school's next prom queen.",She's All That,1999-01-29,26.609,6.319,2093
1636,9273,"Summoned from an ashram in Tibet, Ace finds himself on a perilous journey into the jungles of Africa to find Shikaka, the missing sacred animal of the friendly Wachati tribe. He must accomplish this before the wedding of the Wachati's Princess to the prince of the warrior Wachootoos. If Ace fails, the result will be a vicious tribal war.",Ace Ventura: When Nature Calls,1995-11-10,38.209,6.319,4162
1637,625450,"Jodi, the tallest girl in her high school, has always felt uncomfortable in her own skin. But after years of slouching, being made fun of, and avoiding attention at all costs, Jodi finally decides to find the confidence to stand tall.",Tall Girl,2019-09-13,23.377,6.318,1869
1638,298312,"A brother and sister are sent to their grandparents' remote Pennsylvania farm for a week, where they discover that the elderly couple is involved in something deeply disturbing.",The Visit,2015-09-10,34.327,6.318,4761
1639,52520,"Having escaped years of imprisonment, vampire warrioress Selene finds herself in a changed world where humans have discovered the existence of both Vampire and Lycan clans and are conducting an all-out war to eradicate both immortal species. Now Selene must battle the humans and a frightening new breed of super Lycans to ensure the death dealers' survival.",Underworld: Awakening,2012-01-19,40.464,6.3,4077
1640,86331,"In a social context deteriorated by a countrywide economic crisis, the life of several people will be turned upside down after they meet Cécile, a character who symbolizes desire.",Desire,2011-10-06,60.812,6.314,1263
1641,14177,"Far from Chicago, hairdresser Gina Norris has relocated to Atlanta with her daughter and has quickly established herself as a rare talent in her profession. But after repeatedly butting heads with her shady, over-the-top boss, Jorge, Norris sets out to create her own salon -- even snagging a few of Jorge's employees and clients. Now, Jorge will do anything to shut her down.",Beauty Shop,2005-04-22,11.96,6.3,510
1642,640146,"Super-Hero partners Scott Lang and Hope van Dyne, along with with Hope's parents Janet van Dyne and Hank Pym, and Scott's daughter Cassie Lang, find themselves exploring the Quantum Realm, interacting with strange new creatures and embarking on an adventure that will push them beyond the limits of what they thought possible.",Ant-Man and the Wasp: Quantumania,2023-02-15,55.826,6.313,5076
1643,331836,"Franck and his girlfriend Sonya, plus some of their friends go on holiday in Brazil. Franck, his friends, two girls and Sonya's grandmother leave to visit a cave, but everything goes wrong and their crazy adventures begin.",Babysitting 2,2015-12-02,11.509,6.313,1347
1644,46929,"Jiminy Cricket hosts two Disney animated shorts: Bongo about a circus bear escaping to the wild, and Mickey and the Beanstalk, a take on the famous fairy tale.",Fun and Fancy Free,1947-09-27,21.471,6.3,480
1645,527660,"Alice, a young innocent Catholic girl, is tempted into masturbating after an AOL chat suddenly turns sexual, however is conflicted as the act would be considered a sin.","Yes, God, Yes",2020-07-24,18.101,6.3,529
1646,458344,"Annie is stuck in a long-term relationship with Duncan – an obsessive fan of obscure rocker Tucker Crowe. When the acoustic demo of Tucker's hit record from 25 years ago surfaces, its discovery leads to a life-changing encounter with the elusive rocker himself.","Juliet, Naked",2018-08-16,11.153,6.309,482
1647,437557,"When three parents discover that each of their daughters have a pact to lose their virginity at prom, they launch a covert one-night operation to stop the teens from sealing the deal.",Blockers,2018-03-14,24.283,6.309,1990
