,id,overview,title,release_date,popularity,vote_average,vote_count
1102,763329,"Finding himself down and out in Los Angeles, former porn star Mikey Saber decides to crawl back to his hometown of Texas City, Texas, where his estranged wife and mother-in-law are living. Just as this dysfunctional family seems to be making things work, Mikey meets a young woman named Strawberry working the cash register at a local doughnut shop.",Red Rocket,2021-12-10,11.553,6.765,486
1103,762441,"As New York City is invaded by alien creatures who hunt by sound, a woman named Sam fights to survive with her cat.",A Quiet Place: Day One,2024-06-26,222.574,6.8,2422
1104,534490,"While on a prison furlough, a lowly criminal evades his guards and returns to his old stomping ground to take revenge on the people who turned him into a cold blooded killer.",Avengement,2019-05-24,21.051,6.765,498
1105,11253,"Hellboy, his pyrokinetic girlfriend, Liz, and aquatic empath, Abe Sapien, face their biggest battle when an underworld elven prince plans to reclaim Earth for his magical kindred. Tired of living in the shadow of humans, Prince Nuada tries to awaken an ancient force of killing machines, the all-powerful Golden Army, to clear the way for fantasy creatures to roam free. Only Hellboy can stop the dark prince and prevent humanity's annihilation.",Hellboy II: The Golden Army,2008-07-11,34.196,6.763,5205
1106,9374,"Madeline is married to Ernest, who was once arch-rival Helen's fiance. After recovering from a mental breakdown, Helen vows to kill Madeline and steal back Ernest. Unfortunately for everyone, the introduction of a magic potion causes things to be a great deal more complicated than a mere murder plot.",Death Becomes Her,1992-07-30,26.915,6.763,2654
1107,3784,"When Johnny is released from prison following a forgery charge, he quickly lands a job as a short-order cook at a New York diner. Following a brief fling with waitress Cora, Frankie develops an attraction for Cora's friend and fellow waitress Frankie. While Frankie resists Johnny's charms initially, she eventually relents when her best friend, Tim, persuades her to give Johnny a chance.",Frankie and Johnny,1991-10-11,17.689,6.762,578
1108,3079,Baron Victor Frankenstein has discovered life's secret and unleashed a blood-curdling chain of events resulting from his creation: a cursed creature with a horrid face — and a tendency to kill.,The Curse of Frankenstein,1957-05-20,12.909,6.762,300
1109,535292,"An embattled NYPD detective, is thrust into a citywide manhunt for a pair of cop killers after uncovering a massive and unexpected conspiracy. As the night unfolds, lines become blurred on who he is pursuing, and who is in pursuit of him.",21 Bridges,2019-10-24,20.666,6.8,1969
1110,11835,"Nick Hume is a mild-mannered executive with a perfect life, until one gruesome night he witnesses something that changes him forever. Transformed by grief, Hume eventually comes to the disturbing conclusion that no length is too great when protecting his family.",Death Sentence,2007-08-31,13.259,6.8,1140
1111,10846,"Love and injury in time of war. Attilio de Giovanni teaches poetry in Italy. He has a romantic soul, and women love him. But he is in love with Vittoria, and the love is unrequited. Every night he dreams of marrying her, in his boxer shorts and t-shirt, as Tom Waits sings. Vittoria travels to Iraq with her friend, Fuad, a poet; they are there with the second Gulf War breaks out. Vittoria is injured. Attilio must get to her side, and then, as war rages around him, he must find her the medical care she needs. In war, does love conquer all?",The Tiger and the Snow,2005-10-14,10.744,6.758,478
1112,10711,"""Popeye"" Doyle travels to Marseilles to find Alain Charnier, the drug smuggler that eluded him in New York.",French Connection II,1975-05-18,11.337,6.8,420
1113,8456,"Jake, full of anger after his father's death, is just starting to find a place for himself at his new Orlando high school - until Ryan, head of an underground MMA fight club, picks Jake out as a prime opponent. After being trounced by Ryan in front of the entire school, Jake begins training under the firm, moral guidance of a MMA master, where he learns how to fight... and how to avoid a fight. But it becomes obvious that a rematch will be inevitable if Jake wants to stop Ryan and his bullying, once and for all.",Never Back Down,2008-03-04,40.489,6.758,2310
1114,2266,"Olivier Assayas, Gus Van Sant, Wes Craven and Alfonso Cuaron are among the 20 distinguished directors who contribute to this collection of 18 stories, each exploring a different aspect of Parisian life. The colourful characters in this drama include a pair of mimes, a husband trying to chose between his wife and his lover, and a married man who turns to a prostitute for advice.",Paris Je T'aime,2006-06-21,12.353,6.8,756
1115,840705,"When tech billionaire Slater King meets cocktail waitress Frida at his fundraising gala, he invites her to join him and his friends on a dream vacation on his private island. But despite the epic setting, beautiful people, ever-flowing champagne, and late-night dance parties, Frida can sense that there’s something sinister hiding beneath the island’s lush façade.",Blink Twice,2024-08-21,97.739,6.8,981
1116,38199,The government gets wind of a plot to destroy America involving a trio of nuclear weapons for which the whereabouts are unknown. It's up to a seasoned interrogator and an FBI agent to find out exactly where the nukes are.,Unthinkable,2010-06-14,36.307,6.754,1204
1117,18095,"Son Goku Jr. is the great-great-great-great-grandson of the legendary martial artist Son Goku. However, unlike his predecessor he's not a brave fighter. He's constantly picked on by school bullies, his grandmother Pan sees this and she's worried, but even though Goku Jr. is not a strong and powerful Saiyan, he has a kind heart, and Pan loves him. When Pan gets sick Goku Jr. realizes he must do something if he doesn't want to lose Pan. Then he will remember about the legends of the Dragon Balls. It was told they granted a wish to the bearer, Goku Jr. needs a magical wish more than ever.",Dragon Ball GT: A Hero's Legacy,1997-03-26,37.66,6.8,337
1118,14924,"January 1978. After their success in England, the punk rock band Sex Pistols venture out on their tour of the southern United States. Temperamental bassist Sid Vicious is forced by his band mates to travel without his troubled girlfriend, Nancy Spungen, who will meet him in New York. When the band breaks up and Sid begins his solo career in a hostile city, the turbulent couple definitely falls into the depths of drug addiction.",Sid and Nancy,1986-09-12,12.87,6.754,508
1119,14830,"Dr. Stephen Strange embarks on a wondrous journey to the heights of a Tibetan mountain, where he seeks healing at the feet of the mysterious Ancient One.",Doctor Strange,2007-08-14,10.846,6.8,317
1120,539892,"Kept locked inside the house by her father, 7-year-old Chloe lives in fear and fascination of the outside world, where Abnormals create a constant threat—or so she believes. When a mysterious stranger offers her a glimpse of what's really happening outside, Chloe soon finds that while the truth isn't so simple, the danger is very real.",Freaks,2019-09-12,17.925,6.748,1146
1121,105077,"When the initial Cylon attack against the Twelve Colonies fails to achieve complete extermination of human life as planned, twin Number Ones (Cavils) embedded on Galactica and Caprica must improvise to destroy the human survivors.",Battlestar Galactica: The Plan,2009-10-27,10.042,6.7,430
1122,44251,"A Saiyan Space pod crash-lands on Earth out of which a wounded Saiyan crawls: Broly, the Legendary Super Saiyan. The wounded Broly shouts out in frustration and turns into normal form. The place soon freezes, trapping him in it and he falls into a coma.",Dragon Ball Z: Broly - Second Coming,1994-03-12,40.88,6.7,666
1123,662546,"A young and unskilled fairy godmother that ventures out on her own to prove her worth by tracking down a young girl whose request for help was ignored. What she discovers is that the girl has now become a grown woman in need of something very different than a ""prince charming.""",Godmothered,2020-12-04,15.291,6.7,609
1124,1696,"The murderous, backwoods Firefly family take to the road to escape the vengeful Sheriff Wydell, who is not afraid of being as ruthless as his target.",The Devil's Rejects,2005-07-22,15.662,6.7,1424
1125,11313,A widowed mother and her son change when a mysterious stranger enters their lives.,Hearts in Atlantis,2001-09-28,13.268,6.7,550
1126,5175,"It's vacation time for Carter as he finds himself alongside Lee in Hong Kong wishing for more excitement. While Carter wants to party and meet the ladies, Lee is out to track down a Triad gang lord who may be responsible for killing two men at the American Embassy. Things get complicated as the pair stumble onto a counterfeiting plot. The boys are soon up to their necks in fist fights and life-threatening situations. A trip back to the U.S. may provide the answers about the bombing, the counterfeiting, and the true allegiance of sexy customs agent Isabella.",Rush Hour 2,2001-08-03,67.608,6.744,4140
1127,1008409,"After a chance encounter, headstrong Kathy is drawn to Benny, member of Midwestern motorcycle club the Vandals. As the club transforms into a dangerous underworld of violence, Benny must choose between Kathy and his loyalty to the club.",The Bikeriders,2024-06-19,50.265,6.7,760
1128,614292,"In a small suburb on the outskirts of Rome, the cheerful heat of summer camouflages a stifling atmosphere of alienation. From a distance, the families seem normal, but it’s an illusion: in the houses, courtyards and gardens, silence shrouds the subtle sadism of the fathers, the passivity of the mothers and the guilty indifference of adults. But it’s the desperation and repressed rage of the children that will explode and cut through this grotesque façade, with devastating consequences for the entire community.",Bad Tales,2020-06-15,6.192,6.743,572
1129,390734,"The magical kingdom of Lucis is home to the world’s last remaining Crystal, and the menacing empire of Niflheim is determined to steal it. King Regis of Lucis commands an elite force of soldiers called the Kingsglaive. Wielding their king’s magic, they fight to protect Lucis. As the overwhelming military might of the empire bears down, King Regis is faced with an impossible ultimatum – to marry his son, Prince Noctis to Princess Lunafreya of Tenebrae, captive of Niflheim, and surrender his lands to Niflheim rule.  Although the king concedes, it becomes clear that the empire will stop at nothing to achieve their devious goals, with only the Kingsglaive standing between them and world domination.",Kingsglaive: Final Fantasy XV,2016-07-09,18.465,6.7,695
1130,8536,"Three escaped criminals from the planet Krypton, who have the same powers on Earth as Superman, test the Man of Steel's mettle. Led by General Zod, the Kryptonians take control of the White House and partner with Lex Luthor to destroy Superman and rule the world. But Superman, who made himself human in order to get closer to Lois, realizes he has a responsibility to save the planet.",Superman II,1980-12-12,30.735,6.739,2286
1131,1875,"In the third and final episode of the trilogy, Fantômas imposes a head tax on the rich, threatening to kill those who do not comply.",Fantomas vs. Scotland Yard,1967-03-16,17.443,6.7,515
1132,283350,A woman who is robbed on her way to catch the 1:30 train to Boston is left stranded in New York City. She meets a man who helps her during the course of the night and the two form a romance.,Before We Go,2014-09-04,16.872,6.7,1804
1133,46195,"Captured by smugglers when he was just a hatchling, a macaw named Blu never learned to fly and lives a happily domesticated life in Minnesota with his human friend, Linda. Blu is thought to be the last of his kind, but when word comes that Jewel, a lone female, lives in Rio de Janeiro, Blu and Linda go to meet her. Animal smugglers kidnap Blu and Jewel, but the pair soon escape and begin a perilous adventure back to freedom -- and Linda.",Rio,2011-04-03,59.682,6.738,6699
1134,45610,"The true story of Sam Childers, a former drug-dealing biker who finds God and became a crusader for hundreds of Sudanese children who've been kidnapped and pressed into duty as soldiers.",Machine Gun Preacher,2011-09-23,22.301,6.738,1042
1135,933131,"After a deadly earthquake turns Seoul into a lawless badland, a fearless huntsman springs into action to rescue a teenager abducted by a mad doctor.",Badland Hunters,2024-01-25,65.265,6.7,716
1136,212716,"Medical-school dropout Wallace has been repeatedly burned by bad relationships. So while everyone around him, including his roommate Allan, seems to be finding the perfect partner, Wallace decides to put his love life on hold. It is then that he meets Chantry, an animator who lives with her longtime boyfriend Ben. Wallace and Chantry form an instant connection, striking up a close friendship. Still, there is no denying the chemistry between them, leading the pair to wonder, what if the love of your life is actually your best friend?",What If,2013-09-07,14.578,6.7,1959
1137,105864,An epic journey into the world of dinosaurs where an Apatosaurus named Arlo makes an unlikely human friend.,The Good Dinosaur,2015-11-14,54.332,6.7,5568
1138,19200,"With a serial strangler on the loose, a bookkeeper wanders around town searching for the vigilante group intent on catching the killer.",Shadows and Fog,1991-12-05,9.207,6.7,365
1139,11185,"A murder takes place in the shop of David Lyons, a deaf man who fails to hear the gunshot being fired. Outside, blind man Wally Karue hears the shot but cannot see the perpetrator. Both are arrested, but escape to form an unlikely partnership. Being chased by both the law AND the original killers, can the pair work together to outwit them all?","See No Evil, Hear No Evil",1989-05-12,23.755,6.7,976
1140,13258,"Will is looking for an escape from his family when he encounters Lee, the school bully. Armed with a video camera and a copy of Rambo, Lee plans to make his own action-packed video epic.",Son of Rambow,2007-01-22,11.734,6.7,445
1141,10758,"Jenna is a pregnant, unhappily married waitress in the deep south. She meets a newcomer to her town and falls into an unlikely relationship as a last attempt at happiness.",Waitress,2007-05-25,10.916,6.73,522
1142,565770,"Recent college grad Jaime Reyes returns home full of aspirations for his future, only to find that home is not quite as he left it. As he searches to find his purpose in the world, fate intervenes when Jaime unexpectedly finds himself in possession of an ancient relic of alien biotechnology: the Scarab.",Blue Beetle,2023-08-16,67.069,6.7,2668
1143,463319,"In a kingdom ruled by a young and unpredictable king, the military commander has a secret weapon: a shadow, a look-alike who can fool both his enemies and the King himself. Now he must use this weapon in an intricate plan that will lead his people to victory in a war that the King does not want.",Shadow,2018-09-30,14.13,6.729,390
1144,338958,"Disillusioned with life in the city, feeling out of place in suburbia, and frustrated that her happily ever after hasn’t been so easy to find, Giselle turns to the magic of Andalasia for help. Accidentally transforming the entire town into a real-life fairy tale and placing her family’s future happiness in jeopardy, she must race against time to reverse the spell and determine what happily ever after truly means to her and her family.",Disenchanted,2022-11-18,33.901,6.729,1089
1145,9789,"Accio and Manrico are siblings from a working-class family in 1960s Italy: older Manrico is handsome, charismatic, and loved by all, while younger Accio is sulky, hot-headed, and treats life as a battleground — much to his parents' chagrin. After the former is drawn into left-wing politics, Accio joins the fascists out of spite, but his flimsy beliefs are put to test when he falls for Manrico's like-minded girlfriend.",My Brother Is an Only Child,2007-03-28,14.681,6.7,396
1146,9749,"When investigative reporter Irwin ""Fletch"" Fletcher goes undercover to write a piece on the drug trade at a local beach, he's approached by wealthy businessman Alan Stanwyk, who offers him $50,000 to murder him. With sarcastic wit and a knack for disguises, Fletch sets out to uncover Stanwyk's story.",Fletch,1985-05-31,12.224,6.727,671
1147,2462,"The frozen body of Paul Fournier is discovered in Greenland where he had disappeared during a scientific expedition in 1905. Perfectly conserved he is brought back to life in the 1960s. His descendants take care of him: to spare him the cultural shock they behave so to make believe it's 1905 and they are his cousins, uncle...",Hibernatus,1969-09-10,14.336,6.7,470
1148,524216,"In the phantasmagorical town of Raven's End, a misguided young girl takes refuge in a decrepit old mortuary. The eccentric undertaker chronicles the strange history of the town through a series of twisted tales, each more terrifying than the last, but the young girl's world is unhinged when she discovers that the final story... is her own.",The Mortuary Collection,2020-09-25,14.828,6.7,430
1149,249397,The continuation of Joe's sexually dictated life delves into the darker aspects of her adult life and what led to her being in Seligman's care.,Nymphomaniac: Vol. II,2013-12-25,64.605,6.7,2925
1150,399170,"Trying to reverse a family curse, brothers Jimmy and Clyde Logan set out to execute an elaborate robbery during the legendary Coca-Cola 600 race at the Charlotte Motor Speedway.",Logan Lucky,2017-08-17,42.09,6.7,3528
1151,198185,"In a last-ditch effort to save his career, sports agent JB Bernstein dreams up a wild game plan to find Major League Baseball’s next great pitcher from a pool of cricket players in India. He soon discovers two young men who can throw a fastball but know nothing about the game of baseball. Or America. It’s an incredible and touching journey that will change them all — especially JB, who learns valuable lessons about teamwork, commitment and family.",Million Dollar Arm,2014-05-09,10.059,6.7,614
1152,21385,"In Disney's take on the Alexander Dumas tale, Mickey Mouse, Donald Duck and Goofy want nothing more than to perform brave deeds on behalf of their queen (Minnie Mouse), but they're stymied by the head Musketeer, Pete. Pete secretly wants to get rid of the queen, so he appoints Mickey and his bumbling friends as guardians to Minnie, thinking such a maneuver will ensure his scheme's success. The score features songs based on familiar classical melodies.","Mickey, Donald, Goofy: The Three Musketeers",2004-08-04,27.074,6.7,935
1153,13312,"Scarred for life after a harrowing near-death experience, emotionally fragile mother-to-be Sarah is still struggling to come to terms with her loss. Overcome with silent grief, Sarah now seeks solace in work; however, she is on a collision course with sheer terror when a knock at the door in the dead of night chills her bones to the marrow. Now, the raven-haired, late-night visitor in black wants something precious from Sarah, and will stop at nothing to get it.",Inside,2007-06-13,14.436,6.7,824
1154,10591,"Exceptionally ambitious high schooler Matthew has aspirations for a career in politics when he falls in love with his gorgeous 19-year-old neighbor, Danielle. But Matthew's bright future is jeopardized when he finds Danielle was once a porn star. As Danielle's past catches up with her, Matthew's love for her forces him to re-evaluate his goals.",The Girl Next Door,2004-04-09,69.834,6.7,3573
1155,16121,"A veteran sergeant of World War I leads a squad in World War II, always in the company of the survivor Pvt. Griff, the writer Pvt. Zab, the Sicilian Pvt. Vinci and Pvt. Johnson, in Vichy French Africa, Sicily, D-Day at Omaha Beach, Belgium and France, and ending in a concentration camp in Czechoslovakia where they face the true horror of war.",The Big Red One,1980-01-22,10.868,6.72,311
1156,9538,"After a man with extraordinary—and frighteningly destructive—telepathic abilities is nabbed by agents from a mysterious rogue corporation, he discovers he is far from the only possessor of such strange powers, and that some of the other “scanners” have their minds set on world domination, while others are trying to stop them.",Scanners,1981-01-14,13.922,6.7,1204
1157,814776,Unpopular best friends PJ and Josie start a high school self-defense club to meet girls and lose their virginity. They soon find themselves in over their heads when the most popular students start beating each other up in the name of self-defense.,Bottoms,2023-08-25,25.749,6.7,634
1158,467632,"A thief makes a disturbing discovery in the house where he breaks in. Later, when he returns to the same house with his partner in crime, things are no longer how he expected.",Bad Samaritan,2018-04-19,16.066,6.7,684
1159,463858,"Antoine is about to start his first year of medical school… for the third time. Benjamin, just out of high school, will make his first try. He soon realizes it's not exactly a walk in the park. In a fiercely competitive environment, with nights dedicated to hard studying rather than hard partying, the two freshmen will have to adapt and find a middle ground between despair for the present and hope for the future.",The Freshmen,2018-09-12,10.216,6.7,693
1160,458594,"A grieving mother transforms herself into a vigilante following the murders of her husband and daughter, eluding the authorities to deliver her own personal brand of justice.",Peppermint,2018-09-06,24.336,6.7,2068
1161,200505,"At the NFL Draft, general manager Sonny Weaver has the opportunity to rebuild his team when he trades for the number one pick. He must decide what he's willing to sacrifice on a life-changing day for a few hundred young men with NFL dreams.",Draft Day,2014-04-11,13.749,6.716,927
1162,186161,"In the beautiful area of ​​Paris, Maria and José Ribeiro lived for almost thirty years on the ground floor of a Haussmann building, in their dear little lodge.",The Gilded Cage,2013-04-19,6.329,6.716,335
1163,35554,"An aspiring singer from southern Italy who's just been dumped moves north to Milan, where he falls in love and enters a TV singing competition show.",Cado dalle nubi,2009-11-27,6.51,6.716,1631
1164,11448,"When Lenny and his wife, Amanda, adopt a baby, Lenny realizes that his son is a genius and becomes obsessed with finding the boy's biological mother in hopes that she will be brilliant too. But when he learns that Max's mother is Linda Ash, a kindhearted prostitute and porn star, Lenny is determined to reform her immoral lifestyle. A Greek chorus chimes in to relate the plot to Greek mythology in this quirky comedy.",Mighty Aphrodite,1995-09-13,11.735,6.7,686
1165,455980,"For one month every year, five highly competitive friends hit the ground running in a no-holds-barred game of tag they’ve been playing since the first grade. This year, the game coincides with the wedding of their only undefeated player, which should finally make him an easy target. But he knows they’re coming...and he’s ready.",Tag,2018-05-30,36.463,6.7,3151
1166,62630,A chilling vision of the House of Saddam Hussein comes to life through the eyes of the man who was forced to become the double of Hussein's sadistic son.,The Devil's Double,2011-02-11,15.037,6.7,556
1167,9960,Following a plane crash a group of schoolboys find themselves on a deserted island. They appoint a leader and attempt to create an organized society for the sake of their survival. Democracy and order soon begin to crumble when a breakaway faction regresses to savagery with horrifying consequences.,Lord of the Flies,1963-08-13,15.249,6.7,518
1168,2925,"After years of helping their hubbies climb the ladder of success, three mid-life Manhattanites have been dumped for a newer, curvier model. But the trio is determined to turn their pain into gain. They come up with a cleverly devious plan to hit their exes where it really hurts - in the wallet!",The First Wives Club,1996-09-20,18.444,6.713,752
1169,484641,Beneath Anna Poliatova's striking beauty lies a secret that will unleash her indelible strength and skill to become one of the world's most feared government assassins.,Anna,2019-06-19,38.06,6.712,2721
1170,55420,"On the night of the discovery of a duplicate Earth in the Solar system, an ambitious young student and an accomplished composer cross paths in a tragic accident.",Another Earth,2011-07-22,18.327,6.7,1630
1171,20649,"Strike is a young city drug pusher under the tutelage of drug lord Rodney Little. When a night manager at a fast-food restaurant is found with four bullets in his body, Strike’s older brother turns himself in as the killer. Detective Rocco Klein doesn’t buy the story, however, setting out to find the truth, and it seems that all the fingers point toward Strike & Rodney.",Clockers,1995-09-15,7.666,6.709,321
1172,13851,A chronicle of Bruce Wayne's establishment and progression into Gotham City’s legendary caped crusader through 6 standalone episodes.,Batman: Gotham Knight,2008-07-08,16.639,6.709,696
1173,443009,"On the rocky path to sobriety after a life-changing accident, John Callahan discovers the healing power of art, willing his injured hands into drawing hilarious, often controversial cartoons, which bring him a new lease on life.","Don't Worry, He Won't Get Far on Foot",2018-04-04,10.498,6.7,685
