,id,overview,title,release_date,popularity,vote_average,vote_count
0,278,"Imprisoned in the 1940s for the double murder of his wife and her lover, upstanding banker Andy Dufresne begins a new life at the Shawshank prison, where he puts his accounting skills to work for an amoral warden. During his long stretch in prison, Dufresne comes to be admired by the other inmates -- including an older prisoner named Red -- for his integrity and unquenchable sense of hope.",The Shawshank Redemption,1994-09-23,187.95,8.709,27545
1,238,"Spanning the years 1945 to 1955, a chronicle of the fictional Italian-American Corleone crime family. When organized crime family patriarch, Vito Corleone barely survives an attempt on his life, his youngest son, Michael steps in to take care of the would-be killers, launching a campaign of bloody revenge.",The Godfather,1972-03-14,200.8,8.689,20898
2,240,"In the continuing saga of the Corleone crime family, a young Vito Corleone grows up in Sicily and in 1910s New York. In the 1950s, Michael Corleone attempts to expand the family business into Las Vegas, Hollywood and Cuba.",The Godfather Part II,1974-12-20,110.398,8.571,12609
3,424,The true story of how businessman Oskar Schindler saved over a thousand Jewish lives from the Nazis while they worked as slaves in his factory during World War II.,Schindler's List,1993-12-15,125.702,8.568,16047
4,389,"The defense and the prosecution have rested and the jury is filing into the jury room to decide if a young Spanish-American is guilty or innocent of murdering his father. What begins as an open and shut case soon becomes a mini-drama of each of the jurors' prejudices and preconceptions about the trial, the accused, and each other.",12 Angry Men,1957-04-10,95.338,8.5,8804
5,637,A touching story of an Italian book seller of Jewish ancestry who lives in his own little fairy tale. His creative and happy life would come to an abrupt halt when his entire family is deported to a concentration camp during World War II. While locked up he tries to convince his son that the whole thing is just a game.,Life Is Beautiful,1997-12-20,62.908,8.448,13125
6,550,"A ticking-time-bomb insomniac and a slippery soap salesman channel primal male aggression into a shocking new form of therapy. Their concept catches on, with underground ""fight clubs"" forming in every town, until an eccentric gets in the way and ignites an out-of-control spiral toward oblivion.",Fight Club,1999-10-15,133.92,8.438,29699
7,667257,"After the death of her abusive husband, Matilde finds her new best friend in Miguel, her young, insecure, and disoriented neighbor.",Impossible Things,2021-06-17,12.528,8.4,393
8,539,"When larcenous real estate clerk Marion Crane goes on the lam with a wad of cash and hopes of starting a new life, she ends up at the notorious Bates Motel, where manager Norman Bates cares for his housebound mother.",Psycho,1960-06-22,45.835,8.4,10151
9,40096,"The lively João Grilo and the sly Chicó are poor guys living in the hinterland who cheat a bunch of people in a small town in Northeastern Brazil. When they die, they have to be judged by Christ, the Devil and the Virgin Mary before they are admitted to paradise.",A Dog's Will,2000-09-15,14.744,8.4,1126
10,423,"The true story of pianist Władysław Szpilman's experiences in Warsaw during the Nazi occupation. When the Jews of the city find themselves forced into a ghetto, Szpilman finds work playing in a café; and when his family is deported in 1942, he stays behind, works for a while as a laborer, and eventually goes into hiding in the ruins of the war-torn city.",The Pianist,2002-09-17,70.617,8.38,9271
11,244786,"Under the direction of a ruthless instructor, a talented young drummer begins to pursue perfection at any cost, even his humanity.",Whiplash,2014-10-10,92.556,8.4,15289
12,761053,The final part of the film adaption of the erotic romance novel Gabriel's Inferno written by an anonymous Canadian author under the pen name Sylvain Reynard.,Gabriel's Inferno: Part III,2020-11-19,29.001,8.4,1056
13,1058694,"In a Mexican border town plagued by neglect, corruption, and violence, a frustrated teacher tries an unorthodox new method to break through his students’ apathy and unlock their curiosity, their potential... and perhaps even their genius.",Radical,2023-10-19,30.738,8.4,433
14,807,"Two homicide detectives are on a desperate hunt for a serial killer whose crimes are based on the ""seven deadly sins"" in this dark and haunting film that takes viewers from the tortured remains of one victim to the next. The seasoned Det. Sommerset researches each sin in an effort to get inside the killer's mind, while his novice partner, Mills, scoffs at his efforts to unravel the case.",Se7en,1995-09-22,144.652,8.4,21257
15,207,"At an elite, old-fashioned boarding school in New England, a passionate English teacher inspires his students to rebel against convention and seize the potential of every day, courting the disdain of the stern headmaster.",Dead Poets Society,1989-06-02,65.133,8.307,11388
16,101,"Léon, the top hit man in New York, has earned a rep as an effective ""cleaner"". But when his next-door neighbors are wiped out by a loose-cannon DEA agent, he becomes the unwilling custodian of 12-year-old Mathilda. Before long, Mathilda's thoughts turn to revenge, and she considers following in Léon's footsteps.",Léon: The Professional,1994-09-14,73.584,8.3,14917
17,10494,"Encouraged by her managers, rising pop star Mima takes on a recurring role on a popular TV show, when suddenly her handlers and collaborators begin turning up murdered.",Perfect Blue,1998-02-28,34.725,8.305,2705
18,1139087,"Created for Disney's 100th anniversary, the short features Mickey Mouse corralling a gallery of legendary Disney characters for a group photo.",Once Upon a Studio,2023-09-24,29.675,8.3,358
19,914,Dictator Adenoid Hynkel tries to expand his empire while a poor Jewish barber tries to avoid persecution from Hynkel's regime.,The Great Dictator,1940-10-15,24.204,8.3,3396
20,10376,"The story of a virtuoso piano player who lives his entire life aboard an ocean liner. Born and raised on the ship, 1900 (Tim Roth) learned about the outside world through interactions with passengers, never setting foot on land, even for the love of his life. Years later, the ship may be destroyed, and a former band member fears that 1900 may still be aboard, willing to go down with the ship.",The Legend of 1900,1998-10-28,22.434,8.26,2272
21,8587,"Young lion prince Simba, eager to one day become king of the Pride Lands, grows up under the watchful eye of his father Mufasa; all the while his villainous uncle Scar conspires to take the throne for himself. Amid betrayal and tragedy, Simba must confront his past and find his rightful place in the Circle of Life.",The Lion King,1994-06-24,182.942,8.256,18461
22,670,"With no clue how he came to be imprisoned, drugged and tortured for 15 years, a desperate man seeks revenge on his captors.",Oldboy,2003-11-21,79.648,8.256,8765
23,29259,"Four prison inmates have been hatching a plan to literally dig out of jail when another prisoner, Claude Gaspard, is moved into their cell. They take a risk and share their plan with the newcomer. Over the course of three days, the prisoners and friends break through the concrete floor using a bed post and begin to make their way through the sewer system -- yet their escape is anything but assured.",Le Trou,1960-03-18,15.1,8.254,483
24,630566,"Young musician Zach Sobiech discovers his cancer has spread, leaving him just a few months to live. With limited time, he follows his dream and makes an album, unaware that it will soon be a viral music phenomenon.",Clouds,2020-10-09,17.431,8.3,1007
25,110420,"After her werewolf lover unexpectedly dies in an accident, a woman must find a way to raise the son and daughter that she had with him. However, their inheritance of their father's traits prove to be a challenge for her.",Wolf Children,2012-07-21,28.71,8.225,2294
26,603,"Set in the 22nd century, The Matrix tells the story of a computer hacker who joins a group of underground insurgents fighting the vast and powerful computers who now rule the earth.",The Matrix,1999-03-31,149.361,8.2,25911
27,315162,"Puss in Boots discovers that his passion for adventure has taken its toll: He has burned through eight of his nine lives, leaving him with only one life left. Puss sets out on an epic journey to find the mythical Last Wish and restore his nine lives.",Puss in Boots: The Last Wish,2022-12-07,161.293,8.2,7936
28,98,"After the death of Emperor Marcus Aurelius, his devious son takes power and demotes Maximus, one of Rome's most capable generals who Marcus preferred. Eventually, Maximus is forced to become a gladiator and battle to the death against other men for the amusement of paying audiences.",Gladiator,2000-05-04,220.985,8.2,19217
29,441130,"In a time of superstition and magic, when wolves are seen as demonic and nature an evil to be tamed, a young apprentice hunter comes to Ireland with her father to wipe out the last pack. But when she saves a wild native girl, their friendship leads her to discover the world of the Wolfwalkers and transform her into the very thing her father is tasked to destroy.",Wolfwalkers,2020-10-26,24.515,8.219,1203
30,284,"Bud Baxter is a minor clerk in a huge New York insurance company, until he discovers a quick way to climb the corporate ladder. He lends out his apartment to the executives as a place to take their mistresses. Although he often has to deal with the aftermath of their visits, one night he's left with a major problem to solve.",The Apartment,1960-06-21,25.661,8.2,2341
31,324786,"WWII American Army Medic Desmond T. Doss, who served during the Battle of Okinawa, refuses to kill people and becomes the first Conscientious Objector in American history to receive the Congressional Medal of Honor.",Hacksaw Ridge,2016-10-07,109.904,8.2,13842
32,522924,"A family dog – with a near-human soul and a philosopher's mind – evaluates his life through the lessons learned by his human owner, a race-car driver.",The Art of Racing in the Rain,2019-08-08,30.545,8.2,1493
33,476292,"Maquia is a member of a special race called the Iorph who can live for hundreds of years. However, Maquia has always felt lonely despite being surrounded by her people, as she was orphaned from a young age. She daydreams about the outside world, but dares not travel from her home due to the warnings of the clan's chief.  One day the kingdom of Mezarte invades her homeland. They already have what is left of the giant dragons, the Renato, under their control, and now their king wishes to add the immortality to his bloodline.  They ravage the Iorph homeland and kill most of its inhabitants. Caught in the midst of the attack, Maquia is carried off by one of the Renato. It soon dies, and she is left deserted in a forest, now truly alone save for the cries of a single baby off in the distance. Maquia finds the baby in a destroyed village and decides to raise him as her own, naming him Ariel. Although she knows nothing of the human world, how to raise a child that ages much faster than her.",Maquia: When the Promised Flower Blooms,2018-02-24,20.21,8.2,634
34,361743,"After more than thirty years of service as one of the Navy’s top aviators, and dodging the advancement in rank that would ground him, Pete “Maverick” Mitchell finds himself training a detachment of TOP GUN graduates for a specialized mission the likes of which no living pilot has ever seen.",Top Gun: Maverick,2022-05-21,175.728,8.191,9449
35,111,"After getting a green card in exchange for assassinating a Cuban government official, Tony Montana stakes a claim on the drug trade in Miami. Viciously murdering anyone who stands in his way, Tony eventually becomes the biggest drug lord in the state, controlling nearly all the cocaine that comes through Miami. But increased pressure from the police, wars with Colombian drug cartels and his own drug-fueled paranoia serve to fuel the flames of his eventual downfall.",Scarface,1983-12-09,91.361,8.2,11936
36,851644,"In 1999, a teen girl keeps close tabs on a boy in school on behalf of her deeply smitten best friend – then she gets swept up in a love story of her own.",20th Century Girl,2022-10-06,105.614,8.2,703
37,1422,"To take down South Boston's Irish Mafia, the police send in one of their own to infiltrate the underworld, not realizing the syndicate has done likewise. While an undercover cop curries favor with the mob kingpin, a career criminal rises through the police ranks. But both sides soon discover there's a mole among them.",The Departed,2006-10-04,83.31,8.162,15006
38,489,"Headstrong yet aimless, Will Hunting has a genius-level IQ but chooses to work as a janitor at MIT. When he secretly solves highly difficult graduate-level math problems, his talents are discovered by Professor Gerald Lambeau, who decides to help the misguided youth reach his potential. When Will is arrested for attacking a police officer, Professor Lambeau makes a deal to get leniency for him if he gets court-ordered therapy. Eventually, therapist Dr. Sean Maguire helps Will confront the demons that are holding him back.",Good Will Hunting,1997-12-05,78.38,8.162,12489
39,426,"A retired San Francisco detective suffering from acrophobia investigates the strange activities of an old friend's wife, all the while becoming dangerously obsessed with her.",Vertigo,1958-05-28,36.403,8.162,5781
40,103,A mentally unstable Vietnam War veteran works as a night-time taxi driver in New York City where the perceived decadence and sleaze feed his urge for violent action.,Taxi Driver,1976-02-09,60.256,8.1,12357
41,81481,"Based on actual events that took place at Gwangju Inhwa School for the hearing-impaired, where young deaf students were the victims of repeated sexual assaults by faculty members over a period of five years in the early 2000s.",Silenced,2011-09-22,26.57,8.1,645
42,20914,Four inseparable friends try to face their midlife crisis with daytrips and pranks at the expense of their families and the people around them.,My Friends,1975-10-24,10.538,8.1,701
43,1398,"Near a gray and unnamed city is the Zone, a place guarded by barbed wire and soldiers, and where the normal laws of physics are victim to frequent anomalies. A stalker guides two men into the Zone, specifically to an area in which deep-seated desires are granted.",Stalker,1979-05-25,28.042,8.137,2198
44,20334,"Two employees at a gift shop can barely stand one another, without realising that they are falling in love through the post as each other's anonymous pen pal.",The Shop Around the Corner,1940-01-12,20.842,8.1,734
45,470044,"Raised in a poverty-stricken slum, a 16-year-old girl named Starr now attends a suburban prep school. After she witnesses a police officer shoot her unarmed best friend, she's torn between her two very different worlds as she tries to speak her truth.",The Hate U Give,2018-10-19,24.1,8.1,2131
46,935,"After the insane General Jack D. Ripper initiates a nuclear strike on the Soviet Union, a war room full of politicians, generals and a Russian diplomat all frantically try to stop the nuclear strike.",Dr. Strangelove or: How I Learned to Stop Worrying and Love the Bomb,1964-01-29,28.864,8.116,5658
47,531428,"On an isolated island in Brittany at the end of the eighteenth century, a female painter is obliged to paint a wedding portrait of a young woman.",Portrait of a Lady on Fire,2019-09-18,53.723,8.1,2578
48,55823,"Italy, 1916. Oreste Jacovacci and Giovanni Busacca are called, as all the Italian youths, to serve the army in the WWI. They both try in every way to avoid serving the army.",The Great War,1959-10-28,7.027,8.115,343
49,3780,"Aspiring to an easy job as personal physician to a wealthy family, Noboru Yasumoto is disappointed when his first post after medical school takes him to a small country clinic under the gruff doctor Red Beard. Yasumoto rebels in numerous ways, but Red Beard proves a wise and patient teacher. He gradually introduces his student to the unglamorous side of the profession, ultimately assigning him to care for a prostitute rescued from a local brothel.",Red Beard,1965-04-03,12.497,8.115,361
50,11878,"A nameless ronin, or samurai with no master, enters a small village in feudal Japan where two rival businessmen are struggling for control of the local gambling trade. Taking the name Sanjuro Kuwabatake, the ronin convinces both silk merchant Tazaemon and sake merchant Tokuemon to hire him as a personal bodyguard, then artfully sets in motion a full-scale gang war between the two ambitious and unscrupulous men.",Yojimbo,1961-04-25,19.353,8.1,1476
51,10681,"What if mankind had to leave Earth and somebody forgot to turn the last robot off? After hundreds of years doing what he was built for, WALL•E discovers a new purpose in life when he meets a sleek search robot named EVE. EVE comes to realize that WALL•E has inadvertently stumbled upon the key to the planet's future, and races back to space to report to the humans. Meanwhile, WALL•E chases EVE across the galaxy and sets into motion one of the most imaginative adventures ever brought to the big screen.",WALL·E,2008-06-22,93.95,8.095,18907
52,755812,"Marinette’s class is headed to New York, the city of superheroes, for French-American Friendship Week. The whole class is there...except Adrien, whose father refuses to let him go!","Miraculous World: New York, United HeroeZ",2020-09-25,38.103,8.1,1093
53,38,"Joel Barish, heartbroken that his girlfriend underwent a procedure to erase him from her memory, decides to do the same. However, as he watches his memories of her fade away, he realises that he still loves her, and may be too late to correct his mistake.",Eternal Sunshine of the Spotless Mind,2004-03-19,76.976,8.1,15098
54,103663,"A teacher lives a lonely life, all the while struggling over his son’s custody. His life slowly gets better as he finds love and receives good news from his son, but his new luck is about to be brutally shattered by an innocent little lie.",The Hunt,2012-06-13,30.673,8.093,4230
55,7345,"Ruthless silver miner, turned oil prospector, Daniel Plainview, moves to oil-rich California. Using his son to project a trustworthy, family-man image, Plainview cons local landowners into selling him their valuable properties for a pittance. However, local preacher Eli Sunday suspects Plainview's motives and intentions, starting a slow-burning feud that threatens both their lives.",There Will Be Blood,2007-12-26,45.072,8.075,6678
56,555604,"During the rise of fascism in Mussolini's Italy, a wooden boy brought magically to life struggles to live up to his father's expectations.",Guillermo del Toro's Pinocchio,2022-11-09,45.799,8.073,2939
57,397567,"Having died unexpectedly, firefighter Ja-hong is taken to the afterlife by 3 afterlife guardians. Only when he passes 7 trials over 49 days and proves he was innocent in human life, he’s able to reincarnate, and his 3 afterlife guardians are by his side to defend him in trial.",Along with the Gods: The Two Worlds,2017-12-20,41.522,8.1,1055
58,548,"Brimming with action while incisively examining the nature of truth, ""Rashomon"" is perhaps the finest film ever to investigate the philosophy of justice. Through an ingenious use of camera and flashbacks, Kurosawa reveals the complexities of human nature as four people recount different versions of the story of a man's murder and the rape of his wife.",Rashomon,1950-08-26,22.87,8.073,2242
59,872585,The story of J. Robert Oppenheimer's role in the development of the atomic bomb during World War II.,Oppenheimer,2023-07-19,135.404,8.071,9671
60,42229,Two neighbours — a persecuted journalist and a resigned housewife — forge a strong bond on the day of Adolf Hitler's historic 1938 visit to Rome.,A Special Day,1977-08-11,11.689,8.1,663
61,310569,"After leaving her daughter Jessica in a small town in Pernambuco to be raised by relatives, Val spends the next 13 years working as a nanny to Fabinho in São Paulo. She has financial stability but has to live with the guilt of having not raised Jessica herself. As Fabinho’s university entrance exams approach, Jessica reappears in her life and seems to want to give her mother a second chance. However, Jessica has not been raised to be a servant and her very existence will turn Val’s routine on its head. With precision and humour, the subtle and powerful forces that keep rigid class structures in place and how the youth may just be the ones to shake it all up.",The Second Mother,2015-06-04,8.92,8.047,731
62,26022,"Rizwan Khan, a Muslim from the Borivali section of Mumbai, has Asperger's syndrome. He marries a Hindu single mother, Mandira, in San Francisco. After 9/11, Rizwan is detained by authorities at LAX who treat him as a terrorist because of his condition and his race.",My Name Is Khan,2010-02-10,24.137,8.0,1317
63,7347,"In 1997, before the visit of the pope to Rio de Janeiro, Captain Nascimento from BOPE (Special Police Operations Battalion) is assigned to eliminate the risks of the drug dealers in a dangerous slum nearby where the pope intends to be lodged.",Elite Squad,2007-10-12,36.63,8.0,2434
64,120467,"The Grand Budapest Hotel tells of a legendary concierge at a famous European hotel between the wars and his friendship with a young employee who becomes his trusted protégé. The story involves the theft and recovery of a priceless Renaissance painting, the battle for an enormous family fortune and the slow and then sudden upheavals that transformed Europe during the first half of the 20th century.",The Grand Budapest Hotel,2014-02-26,78.062,8.0,14889
65,9277,A novice con man teams up with an acknowledged master to avenge the murder of a mutual friend by pulling off the ultimate big con and swindling a fortune from a big-time mobster.,The Sting,1973-12-25,22.763,8.027,2623
66,610461,"Regina, our young protagonist, always dreamed of getting married. And she did it - but the dream lasted much less than she thought and now she has to face life in a very funny way as a divorcee.","Veinteañera, divorciada y fantástica",2020-02-14,5.837,8.0,387
67,204,"In a run-down South American town, four men are paid to drive trucks loaded with nitroglycerin into the jungle through to the oil field. Friendships are tested and rivalries develop as they embark upon the perilous journey.",The Wages of Fear,1953-04-22,18.755,8.0,957
68,400928,"Frank, a single man raising his child prodigy niece Mary, is drawn into a custody battle with his mother.",Gifted,2017-04-07,64.856,8.022,5538
69,521,"An ex-tennis pro carries out a plot to have his wealthy wife murdered after discovering she is having an affair, and assumes she will soon leave him for the other man anyway.",Dial M for Murder,1954-05-29,23.894,8.0,2607
70,526702,"Born free in the American West, Black Beauty is a horse rounded up and brought to Birtwick Stables, where she meets spirited teenager Jo Green. The two forge a bond that carries Beauty through the different chapters, challenges and adventures.",Black Beauty,2020-11-27,15.744,8.004,338
71,3175,"An Irish rogue uses his cunning and wit to work his way up the social classes of 18th century England, transforming himself from the humble Redmond Barry into the noble Barry Lyndon.",Barry Lyndon,1975-12-18,23.277,8.004,2842
72,337404,"In 1970s London amidst the punk rock revolution, a young grifter named Estella is determined to make a name for herself with her designs. She befriends a pair of young thieves who appreciate her appetite for mischief, and together they are able to build a life for themselves on the London streets. One day, Estella’s flair for fashion catches the eye of the Baroness von Hellman, a fashion legend who is devastatingly chic and terrifyingly haute. But their relationship sets in motion a course of events and revelations that will cause Estella to embrace her wicked side and become the raucous, fashionable and revenge-bent Cruella.",Cruella,2021-05-26,93.627,8.0,9401
73,110416,"The story of the last Seal Child’s journey home. After their mother’s disappearance, Ben and Saoirse are sent to live with Granny in the city. When they resolve to return to their home by the sea, their journey becomes a race against time as they are drawn into a world Ben knows only from his mother’s folktales. But this is no bedtime story; these fairy folk have been in our world far too long. It soon becomes clear to Ben that Saoirse is the key to their survival.",Song of the Sea,2014-06-23,18.394,8.0,1428
74,11658,"When two brothers are forced to fight in the Korean War, the elder decides to take the riskiest missions if it will help shield the younger from battle.",Tae Guk Gi: The Brotherhood of War,2004-02-05,19.03,8.003,671
75,595,"Scout Finch, 6, and her older brother Jem live in sleepy Maycomb, Alabama, spending much of their time with their friend Dill and spying on their reclusive and mysterious neighbor, Boo Radley. When Atticus, their widowed father and a respected lawyer, defends a black man named Tom Robinson against fabricated rape charges, the trial and tangent events expose the children to evils of racism and stereotyping.",To Kill a Mockingbird,1962-12-20,23.834,8.0,2622
76,530915,"At the height of the First World War, two young British soldiers must cross enemy territory and deliver a message that will stop a deadly attack on hundreds of soldiers.",1917,2019-12-25,60.794,7.99,12499
