,id,overview,title,release_date,popularity,vote_average,vote_count
548,11450,"Herbert Stempel's transformation into an unexpected television personality unfolds as he secures victory on the cherished American game show, 'Twenty-One.' However, when the show introduces the highly skilled contestant Charles Van Doren to replace Stempel, it compels Stempel to let out his frustrations and call out the show as rigged. Lawyer Richard Goodwin steps in and attempts to uncover the orchestrated deception behind the scenes.",Quiz Show,1994-08-25,15.462,7.3,904
549,10009,"When an impulsive boy named Kenai is magically transformed into a bear, he must literally walk in another's footsteps until he learns some valuable life lessons. His courageous and often zany journey introduces him to a forest full of wildlife, including the lovable bear cub Koda, hilarious moose Rutt and Tuke, woolly mammoths and rambunctious rams.",Brother Bear,2003-10-23,58.634,7.265,5429
550,2277,"Richard Martin buys a gift, a new NDR-114 robot. The product is named Andrew by the youngest of the family's children. ""Bicentennial Man"" follows the life and times of Andrew, a robot purchased as a household appliance programmed to perform menial tasks. As Andrew begins to experience emotions and creative thought, the Martin family soon discovers they don't have an ordinary robot.",Bicentennial Man,1999-12-17,24.622,7.261,3630
551,1598,"Sam Bowden is a small-town corporate attorney. Max Cady is a tattooed, cigar-smoking, Bible-quoting, psychotic rapist. What do they have in common? 14 years ago, Sam was a public defender assigned to Max Cady's rape trial, and he made a serious error: he hid a document from his illiterate client that could have gotten him acquitted. Now, the cagey Cady has been released, and he intends to teach Sam Bowden and his family a thing or two about loss.",Cape Fear,1991-11-13,21.734,7.3,3449
552,413279,Discover what Thor was up to during the events of Captain America: Civil War.,Team Thor,2016-08-28,9.395,7.3,540
553,403450,"It's 1943 and World War II is raging in Europe. In New York, Arturo and Flora the daughter of a restaurant owner are in love, but she is promised in marriage to the son of a Mafia boss. There is a way around this, but to be able to marry Flora, Arturo needs to get permission from her father, who lives in a village in Sicily. Arturo doesn't have any money, so the only way he can get to Sicily is to enlist in the U.S. Army, which is preparing for a landing on the island.",At War for Love,2016-10-27,7.572,7.26,508
554,391713,"Lady Bird McPherson, a strong willed, deeply opinionated, artistic 17 year old comes of age in Sacramento. Her relationship with her mother and her upbringing are questioned and tested as she plans to head off to college.",Lady Bird,2017-09-01,37.758,7.26,8551
555,211387,"The film takes place one year after the events of Captain America: The First Avenger, in which Agent Carter, a member of the Strategic Scientific Reserve, is in search of the mysterious Zodiac.",Marvel One-Shot: Agent Carter,2013-09-03,12.525,7.3,784
556,24748,"Hud Bannon is a ruthless young man who tarnishes everything and everyone he touches. Hud represents the perfect embodiment of alienated youth, out for kicks with no regard for the consequences. There is bitter conflict between the callous Hud and his stern and highly principled father, Homer. Hud's nephew Lon admires Hud's cheating ways, though he soon becomes too aware of Hud's reckless amorality to bear him anymore. In the world of the takers and the taken, Hud is a winner. He's a cheat, but, he explains, ""I always say the law was meant to be interpreted in a lenient manner.""",Hud,1963-05-28,14.092,7.3,310
557,19666,"In 1890s India, an arrogant British commander challenges the harshly taxed residents of Champaner to a high-stakes cricket match.",Lagaan: Once Upon a Time in India,2001-06-15,14.071,7.3,576
558,16227,A man convicted of murdering his wife escapes from prison and works with a woman to try and prove his innocence.,Dark Passage,1947-09-05,11.779,7.3,324
559,15152,"Secret agent OSS 117 foils Nazis, beds local beauties, and brings peace to the Middle East.","OSS 117: Cairo, Nest of Spies",2006-04-19,16.678,7.256,1732
560,13920,"In the racially divided town of Anderson, South Carolina in 1976, football coach Harold Jones spots a mentally disabled African-American young man nicknamed Radio near his practice field and is inspired to befriend him. Soon, Radio is Jones' loyal assistant, and he becomes a student at T.L. Hanna High School. But things start to sour when Coach Jones begins taking guff from parents and fans who feel that his devotion to Radio is getting in the way of the team's quest for a championship.",Radio,2003-10-24,26.319,7.252,733
561,1725,"In the slums of the upper West Side of Manhattan, tensions are high as a gang of Polish-Americans compete against a gang of recently immigrated Puerto Ricans, but this doesn't stop two romantics from each gang falling in love.",West Side Story,1961-12-13,16.525,7.3,1885
562,1029575,"Dan Morgan is many things: a devoted husband, a loving father, a celebrated car salesman. He's also a former assassin. And when his past catches up to his present, he's forced to take his unsuspecting family on a road trip unlike any other.",The Family Plan,2023-12-14,98.372,7.251,1432
563,14003,"Munich, Germany, 1923. Two years have passed since Edward Elric was dragged from his own world to ours, leaving behind his country, his friends and his younger brother, Alphonse. Stripped of his alchemical powers, he has been all this time researching rocketry together with Alphonse Heiderich, a young man who resembles his own brother, hoping to one day find a way back home. His efforts so far had proven fruitless, but after lending a hand to a troubled gipsy girl, Edward is thrown in a series of events that can wreak havoc in both worlds. Meanwhile, at his own world, Alphonse Elric ventures deeper into the mysteries of alchemy in search for a way to reunite with his older brother.",Fullmetal Alchemist the Movie: Conqueror of Shamballa,2005-07-21,22.689,7.3,348
564,13283,"Shipwrecked as a child, Rosella (Barbie) grows up on the island under the watchful eyes of her loving animal friends. The arrival of Prince Antonio leads Rosella and her furry pals to explore civilization and ultimately save the kingdom by uncovering a secret plot.",Barbie as the Island Princess,2007-09-17,27.322,7.3,731
565,25205,"A former world-famous conductor of the Bolshoï orchestra, known as ""The Maëstro"", Andreï Filipov had seen his career publicly broken by Leonid Brezhnev for hiring Jewish musicians and now works cleaning the concert hall where he once directed. One day, he intercepts an official invitation from the prestigious Théâtre du Châtelet. Through a series of mad antics, he reunites his old orchestra, now composed of old alcoholic musicians, and flies to perform in Paris and complete the Tchaikovsky concerto interrupted 30 years earlier. For the concerto, he engages a young violin soloist with whom he has an unexpected connection.",The Concert,2009-11-04,9.602,7.2,497
566,9833,A young soprano becomes the obsession of a disfigured and murderous musical genius who lives beneath the Paris Opera House.,The Phantom of the Opera,2004-12-08,31.457,7.2,1632
567,766,"Ash, a handsome, shotgun-toting, chainsaw-armed department store clerk, is time warped backwards into England's Dark Ages, where he romances a beauty and faces legions of the undead.",Army of Darkness,1992-10-31,27.305,7.247,3176
568,246,"Blind traveler Zatoichi is a master swordsman and a masseur with a fondness for gambling on dice games. When he arrives in a village torn apart by warring gangs, he sets out to protect the townspeople.",Zatoichi,2003-09-06,18.381,7.2,860
569,837881,New York Times reporters Megan Twohey and Jodi Kantor break one of the most important stories in a generation — a story that helped launch the #MeToo movement and shattered decades of silence around the subject of sexual assault in Hollywood.,She Said,2022-11-17,14.383,7.2,601
570,425373,"After the tragic death of star volleyball player Caroline ""Line"" Found, a team of dispirited high school girls must band together under the guidance of their tough-love coach in hopes of winning the state championship!",The Miracle Season,2018-04-13,9.076,7.243,304
571,69735,A wealthy playboy named Bruce Wayne and a Chicago cop named Jim Gordon both return to Gotham City where their lives unexpectedly intersect.,Batman: Year One,2011-09-27,18.623,7.243,960
572,11072,"A town—where everyone seems to be named Johnson—stands in the way of the railroad. In order to grab their land, robber baron Hedley Lamarr sends his henchmen to make life in the town unbearable. After the sheriff is killed, the town demands a new sheriff from the Governor, so Hedley convinces him to send the town the first black sheriff in the west.",Blazing Saddles,1974-02-07,24.469,7.2,1876
573,10559,"When a rare phenomenon gives police officer John Sullivan the chance to speak to his father, 30 years in the past, he takes the opportunity to prevent his dad's tragic death.  After his actions inadvertently give rise to a series of brutal murders he and his father must find a way to fix the consequences of altering time.",Frequency,2000-04-28,22.302,7.2,1789
574,1850,"The story of the life and career of eccentric avant-garde comedian, Andy Kaufman.",Man on the Moon,1999-12-22,15.959,7.243,1784
575,18947,"An ensemble comedy, where the romance is between the young people of the 60s, and pop music. It's about a band of DJs that captivate Britain, playing the music that defines a generation and standing up to a government that  wanted control of popular culture via the British Broadcasting Corporation. Loosely based on the events in Britain in the 60's when the Labour government of Harold Wilson, wanted to bring the pirate radio stations under control, enough to see the passage of the Marine Broadcasting Offences Act on 15 August 1967. Also known as ""Pirate Radio"".",The Boat That Rocked,2009-04-01,13.863,7.239,2109
576,9078,"Wart is a young boy who aspires to be a knight's squire. On a hunting trip he falls in on Merlin, a powerful but amnesiac wizard who has plans for him beyond mere squiredom. He starts by trying to give him an education, believing that once one has an education, one can go anywhere. Needless to say, it doesn't quite work out that way.",The Sword in the Stone,1963-12-25,41.316,7.2,3836
577,4588,"During World War II, a secret agent must seduce then assassinate an official who works for the Japanese puppet government in Shanghai. Her mission becomes clouded when she finds herself falling in love with the man she is assigned to kill.","Lust, Caution",2007-09-24,32.313,7.2,703
578,846214,Loki is banished from Asgard once again and must face his toughest opponents yet: the Simpsons and Springfield’s mightiest heroes. The God of Mischief teams up with Bart Simpson in the ultimate crossover event paying tribute to the Marvel Cinematic Universe of superheroes and villains.,"The Good, the Bart, and the Loki",2021-07-07,22.64,7.238,665
579,209274,"Anna, a young novitiate in 1960s Poland, is on the verge of taking her vows when she discovers a family secret dating back to the years of the German occupation.",Ida,2013-10-25,10.747,7.2,975
580,465136,"16-year old Rhiannon falls in love with a mysterious spirit named “A” that inhabits a different body every day. Feeling an unmatched connection, Rhiannon and “A” work each day to find each other, not knowing what the next day will bring.",Every Day,2018-02-22,12.5,7.233,2203
581,8424,"As adults, best friends Julien and Sophie continue the odd game they started as children -- a fearless competition to outdo one another with daring and outrageous stunts. While they often act out to relieve one another's pain, their game might be a way to avoid the fact that they are truly meant for one another.",Love Me If You Dare,2003-09-17,12.404,7.233,1790
582,268,"Batman must face his most ruthless nemesis when a deformed madman calling himself ""The Joker"" seizes control of Gotham's criminal underworld.",Batman,1989-06-21,54.011,7.233,7907
583,306745,New Jersey car mechanic Stacie Andree and her police detective girlfriend Laurel Hester both battle to secure Hester's pension benefits after she was diagnosed with a terminal illness.,Freeheld,2015-10-02,12.168,7.232,648
584,998022,"When one of her students is suspected of theft, teacher Carla Nowak decides to get to the bottom of the matter. Caught between her ideals and the school system, the consequences of her actions threaten to break her.",The Teachers' Lounge,2023-05-04,17.517,7.2,522
585,614930,"After years of being sheltered from the human world, the Turtle brothers set out to win the hearts of New Yorkers and be accepted as normal teenagers through heroic acts. Their new friend April O'Neil helps them take on a mysterious crime syndicate, but they soon get in over their heads when an army of mutants is unleashed upon them.",Teenage Mutant Ninja Turtles: Mutant Mayhem,2023-07-31,50.53,7.228,1327
586,335360,"A new dark force threatens Ponyville, and the Mane 6 – Twilight Sparkle, Applejack, Rainbow Dash, Pinkie Pie, Fluttershy and Rarity – embark on an unforgettable journey beyond Equestria where they meet new friends and exciting challenges on a quest to use the magic of friendship and save their home.",My Little Pony: The Movie,2017-10-05,19.791,7.2,381
587,5902,The story of Operation Market Garden—a failed attempt by the allies in the latter stages of WWII to end the war quickly by securing three bridges in Holland allowing access over the Rhine into Germany. A combination of poor allied intelligence and the presence of two crack German panzer divisions meant that the final part of this operation (the bridge in Arnhem over the Rhine) was doomed to failure.,A Bridge Too Far,1977-06-15,25.529,7.2,823
588,1538,Cab driver Max picks up a man who offers him $600 to drive him around. But the promise of easy money sours when Max realizes his fare is an assassin.,Collateral,2004-08-04,33.226,7.228,5641
589,170,"Twenty-eight days after a killer virus was accidentally unleashed from a British research facility, a small group of London survivors are caught in a desperate struggle to protect themselves from the infected. Carried by animals and humans, the virus turns those it infects into homicidal maniacs -- and it's absolutely impossible to contain.",28 Days Later,2002-10-31,105.363,7.2,6852
590,38684,"After a bleak childhood, Jane Eyre goes out into the world to become a governess. As she lives happily in her new position at Thornfield Hall, she meet the dark, cold, and abrupt master of the house, Mr. Rochester. Jane and her employer grow close in friendship and she soon finds herself falling in love with him. Happiness seems to have found Jane at last, but could Mr. Rochester's terrible secret be about to destroy it forever?",Jane Eyre,2011-03-11,19.099,7.2,1459
591,73624,"Zero is a brilliant scientist. However, 20 years ago, he was publicly humiliated when he lost Helena, the love of his life. One day, an accidental experience with one of his inventions causes him to travel back in time to 1991. Having taken the opportunity to change history, Zero returns to own time to find totally changed.",The Man from the Future,2011-09-02,6.951,7.2,352
592,5590,A fairy godmother helps a princess disguise herself so she won't have to marry her father.,Donkey Skin,1970-12-20,22.123,7.222,507
593,251,"After a young man is murdered, his spirit stays behind to warn his lover of impending danger, with the help of a reluctant psychic.",Ghost,1990-07-13,48.676,7.222,5579
594,363579,"Set in the late 1920s, The Age of Shadows follows the cat-and-mouse game that unfolds between a group of resistance fighters trying to bring in explosives from Shanghai to destroy key Japanese facilities in Seoul, and Japanese agents trying to stop them.",The Age of Shadows,2016-09-07,14.672,7.2,330
595,204436,"In Scotland 1874, Jack is born on the coldest day ever. Because of the extreme cold, his heart stops beating. The responsible midwife in Edinburgh finds a way to save him by replacing his heart with a clock. So he lives and remains under the midwife's protective care. But he must not get angry or excited because that endangers his life by causing his clock to stop working. Worse than that, when he grows up, he has to face the fact he cannot fall in love because that too could stop his delicate heart.",Jack and the Cuckoo-Clock Heart,2014-02-05,16.911,7.218,713
596,34134,"Barbie stars as Merliah, a surfer who learns a shocking secret: she's a mermaid! She and her dolphin friend set out for an undersea adventure to rescue her mother, the queen of Oceana.",Barbie in A Mermaid Tale,2010-01-25,24.421,7.2,763
597,23168,"Doug MacRay is a longtime thief, who, smarter than the rest of his crew, is looking for his chance to exit the game. When a bank job leads to the group kidnapping an attractive branch manager, he takes on the role of monitoring her – but their burgeoning relationship threatens to unveil the identities of Doug and his crew to the FBI Agent who is on their case.",The Town,2010-09-15,66.385,7.2,5074
598,1621,A snobbish investor and a wily street con-artist find their positions reversed as part of a bet by two callous millionaires.,Trading Places,1983-06-07,46.441,7.2,3324
599,642885,"29 years since the Black Flame Candle was last lit, the 17th-century Sanderson sisters are resurrected, and they are looking for revenge. Now it's up to three high school students to stop the ravenous witches from wreaking a new kind of havoc on Salem before dawn on All Hallow's Eve.",Hocus Pocus 2,2022-09-27,44.008,7.217,1679
600,10528,Eccentric consulting detective Sherlock Holmes and Doctor John Watson battle to bring down a new nemesis and unravel a deadly plot that could destroy England.,Sherlock Holmes,2009-12-23,59.152,7.214,13988
601,788734,"Increasingly overshadowed by her boyfriend's recent rise to fame as a contemporary artist creating sculptures from stolen furniture, Signe hatches a vicious plan to reclaim her rightfully deserved attention within the milieu of Oslo's cultural elite.",Sick of Myself,2022-09-30,9.849,7.2,300
602,512895,"The love story between a pampered Cocker Spaniel named Lady and a streetwise mongrel named Tramp. Lady finds herself out on the street after her owners have a baby and is saved from a pack by Tramp, who tries to show her to live her life footloose and collar-free.",Lady and the Tramp,2019-11-12,21.942,7.2,1558
603,348657,Halla declares a one-woman-war on the local aluminium industry. She is prepared to risk everything to protect the pristine Icelandic Highlands she loves… Until an orphan unexpectedly enters her life.,Woman at War,2018-05-22,9.412,7.213,401
604,244403,"A grieving father in a downward spiral stumbles across a box of his recently deceased son's demo tapes and lyrics. Shocked by the discovery of this unknown talent, he forms a band in the hope of finding some catharsis.",Rudderless,2014-10-17,8.253,7.2,308
605,11832,A French housekeeper with a mysterious past brings quiet revolution in the form of one exquisite meal to a circle of starkly pious villagers in late 19th century Denmark.,Babette's Feast,1987-08-11,15.689,7.2,402
606,8329,A television reporter and cameraman follow emergency workers into a dark apartment building and are quickly locked inside with something terrifying.,[REC],2007-11-23,52.47,7.209,4432
607,6479,"Robert Neville is a scientist who was unable to stop the spread of the terrible virus that was incurable and man-made. Immune, Neville is now the last human survivor in what is left of New York City and perhaps the world. For three years, Neville has faithfully sent out daily radio messages, desperate to find any other survivors who might be out there. But he is not alone.",I Am Legend,2007-12-12,89.408,7.209,15809
608,1254,"A 19-year-old searches for her twin brother after he runs away from home, following a fight with their father.","Don't Worry, I'm Fine",2006-09-06,9.896,7.209,570
609,844,Women enter and exit a science fiction author's life over the course of a few years after the author loses the woman he considers his one true love.,2046,2004-10-29,17.991,7.2,909
610,12598,A writer accidentally shoots his blackmailer and tries to hide the body.,Joe: The Busybody,1971-08-31,8.022,7.2,305
611,75624,"After his capture for attempted assassination of the Raikage, leader of Kumogakure, as well as killing Jōnin from Kirigakure and Iwagakure, Naruto is imprisoned in Hōzukijou: A criminal containment facility known as the Blood Prison. Mui, the castle master, uses the ultimate imprisonment technique to steal power from the prisoners, which is when Naruto notices his life has been targeted. Thus begins the battle to uncover the truth behind the mysterious murders and prove Naruto's innocence.",Naruto Shippuden the Movie: Blood Prison,2011-07-30,46.759,7.204,645
612,9820,"Hallie Parker and Annie James are identical twins separated at a young age because of their parents' divorce. Unknowingly to their parents, the girls are sent to the same summer camp where they meet, discover the truth about themselves, and then plot with each other to switch places.",The Parent Trap,1998-07-28,75.512,7.2,4187
613,1278,"When Isabelle and Theo invite Matthew to stay with them, what begins as a casual friendship ripens into a sensual voyage of discovery and desire in which nothing is off limits and everything is possible.",The Dreamers,2003-09-01,46.657,7.2,2865
614,859,"In 18th century France, Marquise de Merteuil asks her ex-lover Vicomte de Valmont to seduce the future wife of another ex-lover of hers in return for one last night with her. Yet things don’t go as planned.",Dangerous Liaisons,1988-12-21,22.579,7.204,1164
615,11020,"In the early 1900s, Miranda attends a girls boarding school in Australia. One Valentine's Day, the school's typically strict headmistress treats the girls to a picnic field trip to an unusual but scenic volcanic formation called Hanging Rock. Despite rules against it, Miranda and several other girls venture off. It's not until the end of the day that the faculty realizes the girls and one of the teachers have disappeared mysteriously.",Picnic at Hanging Rock,1975-09-02,14.118,7.2,788
616,1594,"Inspector Jacques Clouseau, smitten with the accused maid Maria Gambrelli, unwittingly turns a straightforward murder investigation into a comedic series of mishaps, testing the patience of his irritable boss Charles Dreyfus as casualties mount.",A Shot in the Dark,1964-06-23,12.762,7.2,551
617,664300,"College student Danielle must cover her tracks when she unexpectedly runs into her sugar daddy at a shiva - with her parents, ex-girlfriend and family friends also in attendance.",Shiva Baby,2021-03-26,11.905,7.2,633
618,374205,"The glittering Gran Tesoro, a city of entertainment beyond the laws of the government, is a sanctuary for the world’s most infamous pirates, Marines, and filthy rich millionaires. Drawn by dreams of hitting the jackpot, Captain Luffy and his crew sail straight for the gold. But behind the gilded curtains lies a powerful king whose deep pockets and deeper ambitions spell disaster for the Straw Hats and the New World alike.",One Piece Film: GOLD,2016-07-23,24.683,7.2,489
619,330483,Travis and Gabby first meet as neighbors in a small coastal town and wind up in a relationship that is tested by life's most defining events.,The Choice,2016-02-04,17.235,7.2,1891
620,363676,"On 15 January 2009, the world witnessed the 'Miracle on the Hudson' when Captain 'Sully' Sullenberger glided his disabled plane onto the Hudson River, saving the lives of all 155 souls aboard. However, even as Sully was being heralded by the public and the media for his unprecedented feat of aviation skill, an investigation was unfolding that threatened to destroy his reputation and career.",Sully,2016-09-07,32.71,7.2,7217
621,6023,A young widow discovers that her late husband has left her 10 messages intended to help ease her pain and start a new life.,P.S. I Love You,2007-11-15,26.703,7.195,3303
622,459,After a wonderful time in Hungary Sissi falls extremely ill and must retreat to a Mediterranean climate to rest. The young empress’ mother takes her from Austria to recover in Madeira.,Sissi: The Fateful Years of an Empress,1957-12-18,15.384,7.2,331
623,955555,"Detective Ma Seok-do changes his affiliation from the Geumcheon Police Station to the Metropolitan Investigation Team, in order to eradicate Japanese gangsters who enter Korea to commit heinous crimes.",The Roundup: No Way Out,2023-05-31,76.328,7.194,446
624,407655,A contemporary musical version of the classic Cinderella story in which the servant step daughter hope to compete in a musical competition for a famous pop star.,A Cinderella Story: If the Shoe Fits,2016-08-02,27.335,7.194,833
625,10886,"Irena, a Ukrainian woman, comes to Italy looking for a job as a maid. She does everything she can to become a beloved nanny for an adorable little girl, Thea. However, that is just the very beginning of her unknown journey.",The Unknown Woman,2006-10-09,7.971,7.19,347
626,9660,"A World War II submarine commander finds himself stuck with a damaged sub, a con-man executive officer, and a group of army nurses.",Operation Petticoat,1959-12-05,12.451,7.19,357
627,4415,"In 19th century France, Jean Valjean, a man imprisoned for stealing bread, must flee a relentless policeman named Javert. The pursuit consumes both men's lives, and soon Valjean finds himself in the midst of the student revolutions in France.",Les Misérables,1998-05-01,17.108,7.2,625
